genre	file	sentence_1	sentence_2	label
main-captions	images	En rugbyspelare i mörk utrustning bär en ljus rugbyboll med utsträckt arm.	En brun hund plaskar i vattnet medan han bär en boll i munnen.	0.40
main-captions	images	Två personer går genom lite vatten.	Två flickor går vid ett träd framför en tegelbyggnad.	1.20
main-captions	images	En hund som plaskar i vattnet.	En hund plaskar i det grumliga vattnet.	4.00
main-captions	images	En grupp människor går längs trottoaren i en storstad.	En grupp människor åker bak i en lastbil.	1.00
main-captions	images	Hunden är i luften ovanför gräset.	Hunden ligger på en säng med ett blått lakan.	1.00
main-captions	images	En svart hund springer genom lite vatten.	En man i fotbollsuniform springer med en fotboll under en match.	0.00
main-captions	images	Flickan står i tunnelbanan och väntar på något.	En flicka står i ett svagt upplyst område.	2.00
main-captions	images	Mannen sitter med en liten flicka i parken.	Mannen leker med den lurviga lilla hunden.	0.60
main-captions	images	En stor beige hund springer med ett grönt föremål i munnen	Den beiga hunden bär en grön gnisselleksak i munnen.	4.40
main-captions	images	En grupp människor i båtar som kappseglade mot stranden.	Ett klassrum med elever som tittar på en presentation.	0.00
main-captions	images	En person åker skateboard i luften ovanför en ramp.	En cyklist cyklar längs ett spårelement som ligger med ett skogsområde.	0.60
main-captions	images	En pojke åker skateboard ner för metallräcket på natten.	En brun hund springer på sanden och håller i en pinne.	0.00
main-captions	images	En person klämmer sig genom en öppning i bergväggen.	En medelstor brun hund springer genom ett öppet vitt skogsområde.	0.00
main-captions	images	Hund springer mot kameran med en boll i munnen.	Den svartvita hunden simmar med ett brunt föremål i munnen.	2.00
main-captions	images	En ung flicka springer på stranden.	En liten flicka springer på vid strandkanten av en strand.	4.20
main-captions	images	En basebollspelare kastar bollen.	Basketspelaren håller bollen.	1.60
main-captions	images	En man gungar på ett rep över vatten.	En man i en rödbrun baddräkt gungar i ett rep på en sjö.	3.00
main-captions	images	En ung flicka klädd i en Minnie mouse-outfit och en äldre kvinna som går längs trottoaren.	en man klädd i en vit kostym som håller i en tidning som går genom gatorna.	1.00
main-forum	deft-forum	Vad sägs om några vittnesmål från riktiga hälsoexperter?	"Dessutom, vem säger att det inte finns vittnesmål från ""riktiga"" hälsoexperter där?"	3
main-forum	deft-forum	Då var kaptenen borta.	Sedan kom kaptenen tillbaka.	0.8
main-forum	deft-forum	Problemet är enklare än så.	Problemet är enkelt.	3.8
main-forum	deft-forum	NEGATIVA SPANINGSKRAV.	STILLA KRAV .	1
main-forum	deft-forum	"Så jag slutar, för nu, att ställa dig frågan: "" Var är Marx "" ?"	"Jag går vidare och ställer dig frågan: "" Var är biffen "" ?"	0.4
main-forum	deft-forum	gå figur Du ber mig att bevisa ett negativt?	Du ber mig att bevisa ett negativt?	4.6
main-forum	deft-forum	Jag är OK med MEDICINSK användning!	JAG ÄR OK MED MEDICINSK ANVÄNDNING!!	5
main-forum	deft-forum	Priserna på allt du behöver har gått upp på grund av inflationen.	Priserna på allt du äger IE-tillgångar har gått ner.	2
main-forum	deft-forum	Krig i mellanöstern.	ETT KRIG i mellanöstern.	5
main-forum	deft-forum	Ursprungligen Postat av Wien Hur var det auktoritärt?	Ursprungligen Postat av zaf Jag ger upp.	0.6
main-forum	deft-forum	Föreställ dig en plats som är % vit och % svart.	Föreställ dig en plats med % män och % kvinnor.	1
main-forum	deft-forum	Det finns ingen chans till en rättvis rättegång.	det finns ingen chans till en rättvis rättegång.	5
main-forum	deft-forum	Nirvana är väldigt annorlunda än glömskan.	Nirvana är INTE glömska.	3.6
main-forum	deft-forum	Vi i Storbritannien tänker annorlunda än Amerikaner.	Ursprungligen Postat av zaf Vi i Storbritannien tänker annorlunda än Amerikaner.	4
main-forum	deft-forum	Om du svarar ja till och nej till är du förmodligen straight.	Om du svarar nej till  men ja till  så är du förmodligen hetero.	3.1
main-forum	deft-forum	Hela jorden tillsammans producerar tillräckligt med mat för miljarder människor.	Vem producerar nu bara tillräckligt för  miljarder?	2.2
main-forum	deft-forum	BTW han hade lämpliga uppskov för tiden.	Lämpliga uppskov för tiden, va?	3.2
main-forum	deft-forum	Hej, Blå-Ögon, hur är det i London?	**smooches Ran** Hej, Blå-Ögon, hur är det i London?	4.4
main-forum	deft-forum	men i nyhetssändningarna har jag sett att de kallade honom vit.	"men det verkar ha mindre ""inverkan"" om de inte kallade honom vit."	2.2
main-forum	deft-forum	Enligt flickvännen och Zimmerman gjorde han det.	Enligt Zimmerman gjorde han det.	2.4
main-forum	deft-forum	Mina föräldrar har sagt till mig att det är dåligt för en.	Mina lärare har sagt till mig att det är dåligt för en.	2.8
main-forum	deft-forum	.Nazi är en slangterm för NSWP.	Ursprungligen Postat av Odins öga .Nazi är en slang term för NSWP.	4.6
main-forum	deft-forum	Jag är emot dödsstraffet.	Det är därför jag stöder dödsstraffet.	1
main-forum	deft-forum	Nåväl, vad som helst, det är du nu.	Nåväl, vad som helst, du är medveten om det nu.	2.2
main-forum	deft-forum	De producerar ingenting jag kan äta, bära, leva i.	"Tänk på allt du inte kan ""äta, ha på dig eller leva i""."	2.2
main-forum	deft-forum	PENISBILD Matt Holliday äger.	Matt Holliday äger, allihop.	3.8
main-forum	deft-forum	Folk utnyttjade lagarna.	Folk böjde lagarna.	2.8
main-forum	deft-forum	Lustigt, jag tänkte samma sak om lite matematik.	Och här trodde jag att jag kunde mig lite matematik.	2.2
main-forum	deft-forum	"Jag har många år av ""Neener Neener""-rättigheter. Jag använder också sallad."	"Jag har många år av ""Neener Neener""-rättigheter Hej Wiggies!"	2.6
main-forum	deft-forum	"Jag prefixar eller suffixar inte allt med ""du hatar judar""."	Du borde sluta prefixa eller suffixa allt med att du hatar judar.	3
main-forum	deft-forum	I wood har frågat henne om hon är sugen på en träkant.	I wood har åtminstone frågat om en trekant inte var aktuell.	4.8
main-forum	deft-forum	Det är fortfarande ingen mening.	Det är du som inte har någon mening.	1.4
main-forum	deft-forum	Dyrare bostäder.	Dyrare bilar.	1.2
main-forum	deft-forum	"Martin sa: ""Varför följer du efter mig?"""	"Zimmerman svarade: ""Vad gör du här?"""	0.8
main-forum	deft-forum	TROTS UPPSKATTNINGAR FÖR SATELLITINTENSITET FRÅN TAFB OCH SAB ENDAST ÄR T./	SUBJEKTIVA DVORAK INTENSITETSBERÄTTNINGAR FRÅN TAFB OCH SAB ÖKAD TILL KT.	2
main-forum	deft-forum	Älvor finns inte - okej.	Satyrer finns inte - okej.	1.2
main-forum	deft-forum	Vill du veta vad jag tycker är lustigt?	Det är vad jag tycker är lustigt.	2.8
main-forum	deft-forum	När jämförde jag homosexualitet med en utvecklingsstörning?	Jag jämförde homofobi med en utvecklingsstörning.	2.6
main-forum	deft-forum	Om du frågade , konservativa, kommer siffrorna att vara sneda åt höger.	Om du frågade , progressiva, skulle siffrorna vara sneda åt vänster.	2.6
main-forum	deft-forum	Du nämnde inte PFA innan det där inlägget.	Jag nämnde inte besöksförbud heller.	0.8
main-forum	deft-forum	Ramblin' Ros av Nat King Cole Vi är alla kärl fyllda med många underverk.	Tigerns Öga Vi är alla kärl fyllda med många underverk.	2.4
main-forum	deft-forum	från året innan.	uppvärmd.C från året innan.	3
main-forum	deft-forum	Älskar fortfarande den här showen.	Heliga bajs bajs, denna show.	1
main-forum	deft-forum	deras stora fastigheter skyddas av regeringen.	deras stora rikedom skyddas av regeringen.	3.2
main-forum	deft-forum	Grundläggande skillnad, tack?	Grundläggande skillnad?	4.6
main-forum	deft-forum	Hur exakt 'bestraffas' Tyskland för VK:s dumhet?	Exakt hur straffas de?	1.4
main-forum	deft-forum	Z förföljde honom, sköt honom sedan.	"Du påstod att Zimmerman "" förföljde honom, sköt honom sedan ""."	3
main-forum	deft-forum	Jag är inte upprörd, jag är besviken.	Gud välsigne jag är inte upprörd, jag är besviken.	5
main-forum	deft-forum	Vi kom aldrig ur det från första början!	Var kommer pengarna ifrån i första hand?	0.8
main-forum	deft-forum	Yttrandefriheten får konsekvenser!	Om yttrandefriheten får konsekvenser så är den inte gratis.	2.11111111111111
main-forum	deft-forum	om du kunde döda en person för att rädda fyra, skulle du?	Om jag skulle döda en person för att rädda, har jag ingen aning om.	2
main-forum	deft-forum	Det är inte att påtvinga moral.	Det är att införa en lag.	1.1
main-forum	deft-forum	Det beror på hur du definierar extrem.	"Beror på hur du definierar ""extrem""."	5
main-forum	deft-forum	Åtminstone hade Mexiko en närvaro i Kalifornien.	Mexiko har NOLL anspråk på Kalifornien.	1.2
main-forum	deft-forum	Så JA, vi LÄSER bibeln för att lära oss om Kristendomen.	personligen skulle jag läsa bibeln för att lära mig om kristendomen.	3
main-forum	deft-forum	Ah ha, ha, ha, ha, ha!	Ha ha ha ha ha ha!	4.5
main-forum	deft-forum	Och det är därför du skriker på mig och vägrar svara på mina frågor?	Vägrar du fortfarande svara på mina frågor?	3.4
main-forum	deft-forum	Du har för mycket reglering, inte för lite.	Du måste ingripa för mycket på fria marknader, inte för lite.	3.8
main-forum	deft-forum	Det Mänskilga Elementet Du skulle kunna värva Lance Berkman i slutet av året antar jag?	Du skulle kunna värva Lance Berkman i slutet av året antar jag?	4
main-forum	deft-forum	Varför lämnades Tomas Bok utanför kanonen?	Varför skulle tillägget av fler av Jesu ord utelämnas från kanonen?	2.6
main-forum	deft-forum	Du menar att du tror på Mainstream Medias ord?	Du menar att du tror på ordet från SpringHallConvert?	1.8
main-forum	deft-forum	Det är meningen att vi ska utforska.	Det är meningen att vi ska flytta.	2.4
main-forum	deft-forum	Israel ger inte ett ****, acceptera det.	Att Israel inte ger ett **** om vad någon annan tycker.	3.4
main-forum	deft-forum	Vi är alla kärl fyllda med många underverk.	I Want to Rock and Roll av Kiss Vi är alla kärl fyllda med många underverk.	3.4
main-forum	deft-forum	Slutstamp! En kär vän från Ohio skickade detta till mig.	En kär vän från Ohio skickade detta till mig.	3.6
main-forum	deft-forum	Och ändå är Titanic-berättelsen den som håller upp till granskning av bevisen.	Den nya studien visar att Titanic-berättelsen inte håller för granskning imo.	1.6
main-forum	deft-forum	Kan han verkligen tjäna pengar på google ad sense.	Vem tjänar pengar på google ad sense?	3.2
main-forum	deft-forum	De vet att videon inte visar en gaskammare.	Summan av kardemumman är att videoklippet inte visar en gaskammare.	4.6
main-forum	deft-forum	Varmt , kanske rekord.	Varmare , nästan säkert ett rekord.	4.4
main-forum	deft-forum	"Ljus men spretig blir ""behandla med droger""."	"Åsiktsfull och envis blir ""behandling med droger""."	2.2
main-forum	deft-forum	"Vad är din definition av ""liv""?"	Vad är din definition av natur?	1.2
main-forum	deft-forum	Kan vara många saker.	Kan vara ett enkelt misstag.	2.2
main-forum	deft-forum	Ingen utpressning, inga mutor, inga pengar inblandade Han ber om pengar för sin röst.	Ingen utpressning, inga mutor, inga pengar inblandade Endast klass E-brott.	3.8
main-forum	deft-forum	Dr. Neanders reviderade version.	"Neanders reviderade version""?"	4
main-forum	deft-forum	Ska jag bara berätta för henne hur jag känner?	Ska jag vänta och se hur det går?	2.2
main-forum	deft-forum	I. ATLANTISKA KRAV .	STILLA KRAV .	0.8
main-forum	deft-forum	du har inga rester av en missil vid pentagonen.	du har inga vittnen till en missil vid pentagonen.	2.6
main-forum	deft-forum	Jane vill att jag ber den hjälpsamma festgästen att betala för det.	Jag kan inte fatta att hon ber DIG att be den hjälpsamma festgästen om pengar!	2.2
main-forum	deft-forum	vilken kvinna som helst som vill ha preventivmedel kan få det.	Vilken kvinna som helst som vill göra abort kan få en.	1.6
main-forum	deft-forum	Är det lagligt att odla?	Ja, det är lagligt att odla.	2.6
main-forum	deft-forum	"att trycka på en ""gör"" inte engelska."	Att trycka på en skickar en ton.	1.8
main-forum	deft-forum	Vad tycker jag om serien?	Vad tyckte jag om Firefly under tiden?	2.8
main-forum	deft-forum	Vi är alla kärl fyllda med många underverk.	Chuck Close Vi är alla kärl fyllda med många underverk.	3.6
main-forum	deft-forum	Har han supportrar?	Han har definitivt supportrar.	2
main-forum	deft-forum	men okej, ultimat suveränitet?	Alltså, ultimat suveränitet.	2.2
main-forum	deft-forum	det är inget svar.	nej, det är inget svar.	4.8
main-forum	deft-forum	Nazisterna ökar livslängden på ett vapentillstånd från  till  år.	Nazisterna sänkte minimiåldern för att köpa ett skjutvapen från  till .	2.2
main-forum	deft-forum	Men vi kan inte göra det utan hjälp.	"Vi kan inte göra det utan dig."""	3.6
main-forum	deft-forum	Ingen frisk person behöver spelande.	Ingen frisk person behöver sex.	1.4
main-forum	deft-forum	Jag sa att det inte var en person, i juridisk mening.	Om det inte är en person, WTF är det då?	2
main-forum	deft-forum	Ser du att Obama kräver en regleringsreform?	Ser du att Obama kräver Klipp, Cap och Balans?	1.8
main-forum	deft-forum	Leprechauns existerar inte - okej.	Alver finns inte - okej.	3
main-forum	deft-forum	Fick lite Heine och coors light jag startade den igår kväll xanis.	jag började det igår kväll xanis.	2
main-forum	deft-forum	Iran är också undertecknat av NPT och IAEA.	"Måste älska EK factoiden att ""Iran är också ett undertecknat av NPT och IAEA."	4.2
main-forum	deft-forum	Gorgons existerar inte - okej.	Satyrer finns inte - okej.	2
main-forum	deft-forum	Bästa sättet att få ut pengar är att bli av med lobbyn, alltihop.	Bästa sättet att vända på det är att få ut pengar.	3
main-forum	deft-forum	"Jag har många år av ""Neener Neener""-rättigheter Vanligtvis får jag ganska bra vård."	"Jag har många år av ""Neener Neener""-rättigheter, de är knasiga."	3.4
main-forum	deft-forum	Dutchy Har någon hört från Dutchy?	@NickFun, Har någon hört från Dutchy?	3.6
main-forum	deft-forum	Varuexpanderad Värdeform, .	Elementär Vara-Kapitalvärde-Form .	3.6
main-forum	deft-forum	Du är en Kristen.	Därför är du inte en Kristen.	1.4
main-forum	deft-forum	Och det enkla faktum idag?	Jag upprepar: Och det enkla faktum idag?	4
main-forum	deft-forum	Moral har absolut ingenting med det att göra!	och moral och ärlighet har allt att göra med det.	2
main-forum	deft-forum	Åh, du är en så bra person!	Du är en så dålig människa!	1.8
main-forum	deft-forum	Fern Jag tycker att sådana här historier är dumma.	– varg Jag tycker att sådana här historier är dumma.	3.6
main-forum	deft-forum	BILDNING AV CYKLON FÖRVÄNTAS INTE UNDER NÄSTA TIMMAR.	TROPISK CYKLON FÖRVÄNTAS INTE.	3.4
main-forum	deft-forum	Förstår du inte vad den där raden av ord betyder?	Förstår du inte vad ordet 'led' innebär?	1.2
main-forum	deft-forum	Det finns ingen religionsfrihet.	Det finns ingen yttrandefrihet.	1.2
main-forum	deft-forum	Ursprungligen Postat av SolInvictus Budskapet i alla skrifterna är enhet.	Ursprungligen Postat av SolInvictus Ah.	2.4
main-forum	deft-forum	Hur lång tid efter utplåningen ska barnet återvända till skolan?	Hur lång tid efter utplåningen ska det inte längre störa barnet?	3
main-forum	deft-forum	En man och en kvinna är olika ja.	Män och kvinnor är olika ja?	3.4
main-forum	deft-forum	Dubbel Jeopardy verkställer faktiskt en ogiltigförklaring av en jury.	När det gäller laglighet kan jag använda juryns upphävande.	2.2
main-forum	deft-forum	Handledare : Visa mig det smarta barnet.	Handledare : Och varför är hon det dumma barnet?	1
main-forum	deft-forum	religiös fiktion Är inte det överflödigt och repetitivt?	Är inte det överflödigt och repetitivt?	3.2
main-forum	deft-forum	Ursprungligen Postat av anabelle Vad är det för fel med det?	"Ursprungligen Postat av Wien Att ""säga"" vad?"	0
main-forum	deft-forum	Cracklin' Rosie av Neil Diamond Vi är alla kärl fyllda med många underverk.	Jingle Bell Rock av Bobby Helm Vi är alla kärl fyllda med många underverk.	1.6
main-forum	deft-forum	Vissa människor har fullständigt förtroende för de personer som driver dessa institutioner.	Andra människor har inget förtroende alls för de som driver dessa institutioner.	1.6
main-forum	deft-forum	lös förändring började som ett skönlitterärt verk.	Det slutade som ett skönlitterärt verk.	2.2
main-forum	deft-forum	Om det inte var ett liv, skulle det inte kunna födas.	Om den inte levde, skulle den få missfall av sig själv.	3
main-forum	deft-forum	GL, Terral Det är helt fantastiskt.	Hej Ollie: Det är helt fantastiskt.	2.4
main-forum	deft-forum	låt oss anta att vi har % vit och % svart.	Föreställ dig en plats som är % vit och % svart.	3.77777777777778
main-forum	deft-forum	Älvor finns inte - okej.	Leprechauner existerar inte - okej.	1
main-forum	deft-forum	Om så är fallet, ange att det är därför de inte är sanna.	Snälla, vad om dem är inte sant.	3.2
main-forum	deft-forum	-Inte- pratar om det 'och' -Inte- gör någonting.	är ännu värre än att prata om det och inte göra någonting.	2.8
main-forum	deft-forum	"Att vara emot kärnvapen betyder inte ""att inte vilja använda kärnvapen""."	"Att vara emot att använda kärnvapen betyder ""att inte vilja använda kärnvapen""."	1.4
main-forum	deft-forum	Min systerdotter är gift med en svart man.	Min stora systerdotter är halvsvart.	1.4
main-forum	deft-forum	Storbritanniens befolkning är drygt  miljoner.	Den Japanska befolkningen är nästan  miljoner.	1
main-forum	deft-forum	Jag Sköt Sheriffen Vi är alla kärl fyllda med många underverk.	Vi är alla kärl fyllda med många underverk.	3.4
main-forum	deft-forum	Jag hoppas att det här är ingenting.	Jag hoppas allt är ok!	2
main-forum	deft-forum	Pengarna jag spenderade på att adoptera Velociraptor.	De kan vara mina ämnen. Pengarna jag spenderade på att adoptera Velociraptor.	4.2
main-forum	deft-forum	Så du tror faktiskt på varje ord av det Terral skrev?	GL, Terral Hej Corn: Så du tror faktiskt på varje ord av det Terral skrev?	4.2
main-forum	deft-forum	Vad är inte hur vad såldes?	Det är inte så det såldes, gb.	1.6
main-forum	deft-forum	Jag vet att jag skulle hata att vara honom.	Jag skulle hata att vara han också.	4.4
main-forum	deft-forum	det fanns inga vapen.	Naturligtvis fanns det inga vapen.	4.6
main-forum	deft-forum	Det är så dumt att det bara måste vara sant.	Det är roligt att tänka att det ens kan vara sant.	3
main-forum	deft-forum	Personligt ansvar mycket?	Återigen, personligt ansvar.	4.4
main-forum	deft-forum	Lägger du märke till det nonsens du säger?	Och för att vara rättvis, märker du det nonsens du säger?	4.57142857142857
main-forum	deft-forum	Jag antar att jag drog ut den ur folkräkningens bakre del i en hög hatt.	Har folkräkningen en baksida i en hatt?	2.6
main-forum	deft-forum	Hur lutar detta mot Bush??	Var är lutningen mot Bush?	4.4
main-forum	deft-forum	Om det inte var bullocks skulle det inte vara homeopati.	Det är enkel logik Om det inte var bullocks skulle det inte vara homeopati.	4.8
main-forum	deft-forum	Jag har aldrig anklagat honom för övermilligram, ingenting.	Jag har aldrig anklagat honom för att träna en baseboll.	0.4
main-forum	deft-forum	Bailouten var större än TARP Bloomberg-nyheterna.	Bailouten var större än TARP Den här titeln är missvisande.	3.8
main-forum	deft-forum	Mina föräldrar har sagt till mig att det är dåligt för en.	poliser har sagt till mig att det är dåligt för en.	2
main-forum	deft-forum	Hans ståndpunkt är att det är individens risk att ta.	Hans position är som den är för närvarande.	1
main-forum	deft-forum	Läs mer: Du har aldrig träffat någon som är pro-abort?	Du har aldrig träffat någon som är för abort?	4.8
main-forum	deft-forum	Jag har inga problem med de som har pengar!	Jag har många problem med dessa män, alldeles för många att säga här!	0.2
main-forum	deft-forum	Stängde Nixon, Ford och Carter ned oljefälten?	No har stängt av oljefälten.	2
main-forum	deft-forum	Jag vill inte ha en president som 'bryr sig'.	Jag vill inte ha en president som är karasmatisk.	1
main-forum	deft-forum	Det behöver inte vara hjärndött.	Jag har ingen föreslagen modell.	0
main-forum	deft-forum	inga missilbevis.	inga missilvittnen.	3.2
main-forum	deft-forum	Mina lärare har sagt till mig att det är dåligt för en.	poliser har sagt till mig att det är dåligt för en.	2.2
main-forum	deft-forum	Herregud, det är jag som har graviditetssymbolen.	Jag har graviditetstecken.	4.2
main-forum	deft-forum	Då är han inte allsmäktig.	Då är han illvillig.	1.4
main-forum	deft-forum	foliehatt för hundens ansikte, vilken storlek har du på dig?	foliehatt till sargen, vilken storlek har du på dig?	3
main-forum	deft-forum	Som den här  åringen som sköts ihjäl i ett marijuanarelaterat brott.	Eller den  årige pojken som sköts ihjäl med automatvapen av marijuanahandlare.	4.2
main-forum	deft-forum	Om du hoppar upp för att göra en träff får du en straff.	Om din pinne träffar en kille i ansiktet, får du en straff.	2.6
main-forum	deft-forum	ALL elektrisk energi kommer från batteriet.	ALL elektrisk energi kommer i slutändan från generatorn.	2.4
main-forum	deft-forum	Vet du hur många passagerare som vittnade eller vad de sa?	Hur många passagerare sa att de såg ett isberg?	2.4
main-forum	deft-forum	Föreställ dig en plats med % män och % kvinnor.	Föreställ dig en plats som är % vit och % svart.	1.6
main-forum	deft-forum	Scenario A antar att CO-tillväxten accelererar med .%/år.	Den antar att metantillväxten accelererar med .%/år.	1.75
main-forum	deft-forum	De har faktiskt visat en kylande trend sedan på grund av den senaste tidens nedgång.	få en kylande trend från på grund av den senaste tidens nedgång.	4.6
main-forum	deft-forum	Vi är alla kärl fyllda med många underverk.	Landon Memory från CATS Vi är alla kärl fyllda med många underverk.	3
main-forum	deft-forum	för att upprepa: De är INTE lika suveräna som de var tidigare.	De är INTE lika suveräna som de var tidigare.	4.5
main-forum	deft-forum	Utan kontakt och helt opålitlig, men skulle inte.	Utan kontakt och opålitlig?	4.25
main-forum	deft-forum	Det är mest bara Holländare.	I själva verket är det bara Holländarna.	3.6
main-forum	deft-forum	Vi pratar om änglar och vanliga stift igen, eller hur?	@Lustig Andrei, vi pratar om änglar och vanliga stift igen, eller hur?	4.8
main-forum	deft-forum	påståenden om trayvons karaktär Och när gjorde jag det?	sneda bloggar Och när gjorde jag det?	2.6
main-forum	deft-forum	% Hur mycket pengar tar PP in för aborttjänster?	Hur mycket spenderas på aborttjänster?	2.6
main-forum	deft-forum	Varför ägde den transaktionen rum.	Har transaktionen ägt rum?	2.4
main-forum	deft-forum	Det finns ingen mer äggcell efter befruktning.	Det finns inga fler spermier.	2.4
main-forum	deft-forum	Lacey - välkommen tillbaka!	Hur som helst, välkommen tillbaka.	4
main-forum	deft-forum	Mer faktakontroll: Jag vet inte varför någon bråkar om $, vad.	Jag vet inte varför någon bråkar om $, vad.	4.4
main-forum	deft-forum	Om du inte har gjort några påståenden, säg bara till.	Jag har inte gjort några påståenden.	2.4
main-forum	deft-forum	Ingen Thatcherit kan någonsin kalla sig en libertarian.	Det kränker mig alltså när Thatcheriter kallar sig libertarianer.	2.4
main-forum	deft-forum	problemet är inte vem som har pengar.	problemet är vem som inte har pengar.	2.46666666666667
main-forum	deft-forum	Men tror du verkligen att det fanns ett isberg i dessa vatten?	Jag tror inte att det fanns något isberg alls i närheten av Titanic.	2.8
main-forum	deft-forum	inte astros eller orioles dålig Gameday för orioles-spelet är frusen för mig.	Gameday för orioles-spelet är frusen för mig.	3
main-forum	deft-forum	Om så är fallet bör många poliser ta receptbelagda läkemedel.	Om så är fallet borde många uppfinnare, författare ta receptbelagda läkemedel.	2.4
main-forum	deft-forum	Berätta för oss vilka anklagelserna var.	Ja vad är hans anklagelser.	4
main-forum	deft-forum	De är delvis psykopater.	Var Ted Bundy en delvis psykopat?	1.8
main-forum	deft-forum	de som ignorerar historien är dömda att upprepa den.	ooo slå TVÅ de som ignorerar historien är dömda att upprepa den.	4.2
main-forum	deft-forum	detta är INTE en krigsplacering.	det är inte en officiell utplacering.	2.4
main-forum	deft-forum	Nutrax Pluralis av anekdot är inte data Behövde herrar ledsagare?	Nutrax Pluralis av anekdot är inte data	3.6
main-forum	deft-forum	Okej kom precis in.	inte bra Okej kom precis in.	4
main-forum	deft-forum	h och jag läste båda böckerna och tyckte att filmen gick så snabbt.	Jag har inte läst böckerna, men jag såg filmen idag.	3
main-forum	deft-forum	Det är dock inte Moloch-scenen.	Det här är Moloch-scenen.	2.4
main-forum	deft-forum	@Lustig Andrei, Så Lyndon Johnson och John Kennedy var kompatibla?	@edgarblythe, Så Lyndon Johnson och John Kennedy var kompatibla?	4.4
main-forum	deft-forum	Du måste bestämma dig.	Du måste finslipa dina logiska färdigheter.	0.6
main-forum	deft-forum	Den som har går hem efteråt och somnar.	Den som har tre går hem och slår sin fru.	1.4
main-forum	deft-forum	- Admin DrPizza och jag hade glömt vilken gnällig liten sängvätare du är.	och jag hade glömt vilken gnällig liten sängvätare du är.	3.8
main-forum	deft-forum	"Argumentet var ""Albert Einstein gick inte på college""."	"OMG, ""Einstein gick inte på college."""	4.2
