genre	file	sentence_1	sentence_2	label
main-news	MSRpar	"Få ut allt,"" säger Howard Davidowitz, ordförande för Davidowitz & Associates, ett nationellt konsultföretag för detaljhandeln baserat i New York City."	"Oskyldig eller inte, ""hon har skadat varor,"" säger Howard Davidowitz, ordförande för Davidowitz & Associates, ett nationellt konsultföretag för detaljhandel i New York."	1.400
main-news	MSRpar	De uppdaterade produkterna inkluderar Pylon Pro, Pylon Conduit, Pylon Anywhere och Pylon Application Server.	De nya produkterna på skrivbordssidan inkluderar de senaste versionerna av Pylon Conduit och Pylon Pro.	2.800
main-news	MSRpar	Turkiska myndigheter har sagt att alla självmordsbombare var turkar.	Ankara säger att alla fyra självmordsbombare var turkiska.	4.200
main-news	MSRpar	I april hade man prognostiserat ett rörelseresultat i intervallet 60 till 80 cent per aktie.	Kodak förväntar sig en vinst på 5 cent till 25 cent per aktie under kvartalet.	1.000
main-news	MSRpar	Från Florida till Alaska lovade tusentals festglada att driva på för fler lagliga rättigheter, inklusive samkönade äktenskap.	Tusentals festare, som firade beslutet, lovade att driva på för fler lagliga rättigheter, inklusive samkönade äktenskap.	4.200
main-news	MSRpar	Andra med en sådan status är Egypten, Israel och Australien.	Nationer som Israel och Australien har redan en sådan status.	2.500
main-news	MSRpar	Resultaten visas i onsdagens Journal of the American Medical Association (nyheter - webbplatser).	Resultaten ska publiceras i onsdagens nummer av The Journal of the American Medical Association.	3.500
main-news	MSRpar	Dessutom har h2210:s vagga plats för att ladda ett andra batteri.	Vaggan till h2200 har plats för att ladda ett andra batteri.	4.750
main-news	MSRpar	"En av de 14 kurderna pekade på ordet ""flykting"" i en engelsk/turkisk ordbok."	"En man hade viftat med en engelsk-turkisk ordbok och pekat på ordet ""flykting""."	3.500
main-news	MSRpar	Nära samarbete mellan brottsbekämpande myndigheter och underrättelsetjänster är kärnan i den pågående kampen mot terrorismen, sa Howard.	Nära samarbete mellan regionala brottsbekämpande myndigheter och underrättelsetjänster var kärnan i kampen mot terrorism, sade han.	4.000
main-news	MSRpar	Under 2006 säger gruppen att marknaden kommer att återhämta sig med 29,6 procent till 21,3 miljarder dollar i försäljning.	Under 2006 kommer Asien och Stillahavsområdet att rapportera en tillväxt på 7,9 procent till 81,8 miljarder dollar.	2.000
main-news	MSRpar	Kapten Robert Ramsey från US 1st Armored Division sa att en lastbil hade exploderat utanför byggnaden vid 11-tiden och att en av anläggningens ytterväggar hade kollapsat.	Kapten Robert Ramsey vid US 1st Armored Division sa att en lastbil hade exploderat utanför byggnaden vid 11-tiden.	3.200
main-news	MSRpar	I norra hösten kommer amerikanska tränare att arbeta med soldater från fyra nordafrikanska länder med att patrullera och samla in underrättelser.	Senare i år kommer kommandot att skicka tränare med soldater från fyra nordafrikanska nationer på patrullerings- och underrättelseuppdrag.	3.800
main-news	MSRpar	Siffrorna börjar bli katastrofala, säger Dr Patrick Pelloux, ordförande för föreningen för akutmottagningsläkare.	"Det här är oacceptabelt,"" säger Patrick Pelloux, ordförande för Frankrikes sammanslutning av akutläkare."	2.500
main-news	MSRpar	Vad som än har hänt dig i form av straff är verkligen mer än tillräckligt, sa Covello till 49-åringen, vars familj, vänner och supportrar fyllde halva rättssalen.	Det som har hänt dig, sir, som straff är verkligen mer än tillräckligt, sa Covello.	3.000
main-news	MSRpar	Mamman påstod också i rättegången att hon utsatts för sexuella övergrepp av en av vakterna.	Mamman hävdade också att hon utsattes för sexuella övergrepp av en av vakterna under 1998 års konfrontation.	4.000
main-news	MSRpar	Ja, från och med idag kommer Flash-minne köpt från AMD eller Fujitsu att märkas Spansion.	Spansion Flash-minneslösningar är tillgängliga över hela världen från AMD och Fujitsu.	2.625
main-news	MSRpar	Världens två största biltillverkare sa att deras försäljning i USA minskade mer än vad som förutspåddes förra månaden, eftersom en försäljningsfrenesi på sensommaren orsakade mer av en motreaktion i branschen än väntat.	Den inhemska försäljningen hos både GM och nummer 2 Ford Motor Co. minskade mer än förutspått, eftersom en sensommarförsäljningsfrenesi ledde till en större motreaktion än väntat i branschen.	3.200
main-news	MSRpar	En tropisk storm utvecklades snabbt i Mexikanska golfen på söndagen och förväntades träffa någonstans längs Texas eller Louisianas kuster på måndag kväll.	En tropisk storm utvecklades snabbt i Mexikanska golfen på söndagen och kan få orkankraftiga vindar när den slår mot land någonstans längs Louisianakusten måndag kväll.	4.000
main-news	MSRpar	Trycket kan mycket väl öka på torsdag, med nationell täckning av den sista omgången planerad av ESPN, kabelsportnätverket.	Trycket kommer att intensifieras i dag, med nationell bevakning av sista omgången planerad av ESPN och ord som är ännu svårare.	3.200
main-news	MSRpar	Pataki berömde Abrahams beslut och LIPA:s ordförande Richard Kessel sa att kabeln borde hållas i drift permanent.	"LIPAs ordförande Richard Kessel sa att det innebar att kabeln kunde användas ""som vi finner lämpligt."	2.400
main-news	MSRpar	Dynes kom till UC San Diego 1991 efter 22 år som fysiker vid AT&T Bell Labs.	Dynes har varit på UC San Diego sedan 1991 efter att ha tillbringat 22 år med AT&T Bell Labs, där han arbetade med supraledare och annat material.	3.600
main-news	MSRpar	Meningit är en infektion i ryggmärgsvätskan och vävnaden runt hjärnan.	Meningit är en infektion i vätskan i en persons ryggmärg och runt hjärnan.	4.600
main-news	MSRpar	Borgmästare Joe T. Parker sa sent på torsdagen att de tre arbetarna var två män och en kvinna som befann sig inne i byggnaden när den första explosionen inträffade.	De försvunna arbetarna, två män och en kvinna, var inne i byggnaden när den första explosionen inträffade, säger borgmästare Joe T. Parker.	4.400
main-news	MSRpar	"Den Londonbaserade NCRI-tjänstemannen Ali Safavi sa till Reuters: ""Vi fördömer denna razzia, som enligt vår uppfattning är olaglig och moraliskt och politiskt oförsvarlig."""	Vi fördömer denna razzia som enligt vår uppfattning är olaglig och moraliskt och politiskt oförsvarlig, sa den Londonbaserade NCRI-tjänstemannen Ali Safavi till Reuters per telefon.	4.600
main-news	MSRpar	Det exploderade i hans händer, men den tidigare italienska premiärministern var oskadd.	Brevbomben som skickades till Prodi exploderade i hans händer men han var oskadd.	3.600
main-news	MSRpar	Halabis militära advokat, flygmajor James Key, förnekade anklagelserna, som kan leda till dödsstraff.	Advokaten som representerar al-Halabi, Air Force Maj. James Key III, förnekade anklagelserna, enligt The Associated Press.	3.200
main-news	MSRpar	"Waksal sa i ett brev till domstolen: ""Jag slet isär min familj."	När han sökte eftergift bad Waksal om ursäkt till domstolen, sina anställda och sin familj.	2.000
main-news	MSRpar	Sedan början av maj har staden tagit emot 1 400 rapporter om döda blåskrikor och kråkor, sa Jayroe.	Sedan början av maj har staden fått 1 400 anmälningar, sa han.	2.800
main-news	MSRpar	Men Forest, Frihetsorganisationen för rätten att njuta av röktobak, sa: ''Nämn ordet förbud och alla vet vad som hände där.	"Forest, frihetsorganisationen för rätten att njuta av röktobak, sa att de hade tagit emot The Lancets samtal med ""nöje och misstro'""."	1.600
main-news	MSRpar	När den har konverterats kommer BayStar att äga sammanlagt cirka 2,95 miljoner aktier i SCOs stamaktier eller 17,5 procent av bolagets utestående aktier.	Investeringen ger Larkspur, Kalifornien-baserade BayStar mer än 2,9 miljoner aktier i SCO stamaktier, eller 17,5 procent av företagets utestående aktier.	4.000
main-news	MSRpar	OPEC-producenter vid ett möte på onsdagen är inställda på att pressa oberoende oljeexportörer att bidra till kartellens nästa leveransnedskärning för att möjliggöra återvändande av irakisk olja.	OPEC kommer denna vecka att pressa oberoende exportörer att stödja kartellens nästa utbudsnedskärning för att förhindra återupptagandet av irakisk export som underskrider oljepriserna.	2.800
main-news	MSRpar	Federal Trade Commission (FTC) bad kongressen idag om ytterligare behörighet för att bekämpa oönskad Internet-spam, som nu står för upp till hälften av all e-posttrafik.	Federal Trade Commission bad kongressen i går om bredare befogenheter för att attackera det snabbt växande problemet med spam, som nya studier visar står för hälften av all e-posttrafik.	5.000
main-news	MSRpar	En federal storjury åtalade dem på tisdagen; dokumentet var förseglat fram till igår för att myndigheterna skulle kunna göra arresteringar.	Federala tjänstemän sa att dokumentet förblev förseglat fram till torsdag morgon för att tillåta myndigheter att göra arresteringar i fem västerländska stater.	3.400
main-news	MSRpar	"Människor som har motsatt sig dessa handlingar hela tiden försöker nu hitta nya skäl att säga att detta inte var rätt sak att göra."""	Vad som händer här är att människor som har motsatt sig den här handlingen hela tiden försöker hitta nya skäl till varför det inte var rätt sak att göra.	4.000
main-news	MSRpar	Richard Miller blev kvar på sjukhus efter att ha genomgått en levertransplantation, men hans fru har återhämtat sig.	Richard Miller, 57, överlevde en livräddande levertransplantation men är fortfarande inlagd på sjukhus.	3.200
main-news	MSRpar	Efterföljande representanter kunde inte omedelbart nås för kommentarer om SCO:s tillkännagivande.	En talesman för SCO kunde inte nås för en kommentar i eftermiddags.	3.800
main-news	MSRpar	Andelen personer som omfattas av arbetsgivare sjönk från 62,3 procent 2001 till 61,3 procent förra året.	Andelen amerikaner med försäkring från arbetsgivare minskade till 61,3 procent, från 62,6 procent 2001 och 63,6 procent 2000.	3.200
main-news	MSRpar	VÄRLDEN nr 2 Lleyton Hewitt har anklagat Association of Tennis Professionals för illvilja, inklusive ett påstått försök förra året att lura honom till att vägra ett drogtest.	Världen nr.2 Lleyton Hewitt har anklagat sina professionella kamrater för långvarig illvilja, inklusive ett försök förra året att lura honom att vägra ett drogtest.	4.000
main-news	MSRpar	MSN Messenger 6 kommer att vara tillgänglig för nedladdning från kl. 18.00 GMT på onsdag från http://messenger.msn.com/download/v6preview.asp.	MSN Messenger 6-programvaran kommer att vara tillgänglig från kl. 11 PST på onsdag, enligt Microsoft.	3.250
main-news	MSRpar	"I samband med händelsen har jag erkänt att jag betett mig olämpligt."""	Jag har erkänt att jag betedde mig olämpligt, sa han.	4.250
main-news	MSRpar	"En talesman sa: ""Sedan november har vi samarbetat fullt ut med polisen."	"Den tillade att den hade ""samarbetat fullt ut"" med polisen sedan november."	4.250
main-news	MSRpar	Kvinnor som äter potatis och andra knölgrönsaker under graviditeten kan löpa risk att utlösa typ 1-diabetes hos sina barn, tror forskare från Melbourne.	Australiska forskare tror att de har hittat en utlösande faktor för typ 1-diabetes hos barn - deras mödrar äter potatis och andra knölgrönsaker under graviditeten.	4.250
main-news	MSRpar	Det breda Standard & Poor's 500 Index .SPX steg 3 poäng, eller 0,32 procent, till 970.	Det teknologispända Nasdaq Composite Index .IXIC tappade 2 poäng, eller 0,18 procent, till 1 649.	0.750
main-news	MSRpar	Människor som en gång trodde att deras blodtryck var bra kan faktiskt vara på god väg mot högt blodtryck enligt nya amerikanska riktlinjer som publicerades på onsdagen.	Människor som en gång trodde att deras blodtryck var bra behöver faktiskt börja träna och äta bättre, enligt nya amerikanska riktlinjer som publicerades på onsdagen.	3.000
main-news	MSRpar	Amazon rapporterade också att New Yorks justitiekansli hade löst anklagelserna om civila bedrägerier med en av spoofarna som den identifierade.	Amazon och New Yorks justitiekansli har redan gjort upp med en av de påstådda e-postförfalskarna.	3.750
main-news	MSRpar	Huvudskådespelerskan nickade till den energiska nykomlingen Marissa Jaret Winokur som Ednas dotter Tracy.	Marissa Jaret Winokur, som Tracy, vann för bästa skådespelerska i en musikal.	4.000
main-news	MSRpar	Det framgår av vår första rapport att detta var en lärobokslandning med tanke på omständigheterna, sa Burke.	"Sa Mr. Burke: ""Det var en lärobok landning med tanke på omständigheterna."""	4.000
main-news	MSRpar	Allegiant-aktien steg 4 dollar, eller 17,2 procent, till 27,43 dollar under torsdagsmorgonens handel på Nasdaq-börsen.	Allegiants aktie stängde onsdagen på $23,40, upp 64 cent, i handeln på Nasdaq-marknaden.	2.000
main-news	MSRpar	Enligt statlig lag är 911-samtal inte offentlig information och släpptes inte.	Enligt lag är 911-samtal inte allmän information i Rhode Island.	3.400
main-news	MSRpar	Depåbevisen föll med 10 cent till 28,95 USD klockan 10:06 i New York Stock Exchanges sammansatta handel idag.	Aktierna i Fox Entertainment Group Inc., News Corp.s amerikanska media- och underhållningsarm, föll med 45 cent till 26,85 $ i New York Stock Exchanges sammansatta handel.	1.400
main-news	MSRpar	Bremer sa att ett initiativ är att lansera ett nationellt program på 70 miljoner dollar under de kommande två veckorna för att städa upp stadsdelar och bygga samhällsprojekt.	Bremer sa att han skulle lansera ett program på 70 miljoner dollar under de kommande två veckorna för att städa upp stadsdelar över hela Irak och bygga samhällsprojekt, men gav inga detaljer.	3.400
main-news	MSRpar	Nasdaqs sammansatta index lade till 30,46 punkter, eller 2 procent, till 1 520,15.	Nasdaq hade en veckouppgång på 17,27, eller 1,2 procent, och stängde på 1 520,15 efter att ha gått upp 30,46 i går.	2.400
main-news	MSRpar	Det brittiska utrikesdepartementet sa i måndags att koalitionsmyndigheterna i Irak var nöjda med att männen släpptes.	Det brittiska utrikesdepartementet sa att de hade medlat att de två männen släpptes.	2.600
main-news	MSRpar	Wal-Mart uppskattar att mer än 100 miljoner amerikaner besöker deras butiker varje vecka.	Varje vecka besöker 138 miljoner shoppare Wal-Marts 4 750 butiker.	2.800
main-news	MSRpar	"Tillade Mr. Prodi: ""Kanske, men ålderdomen hjälper oss att förstå våra styrkor och vår svaghet."""	Kanske, men ålderdomen hjälper oss att förstå vår styrka och vår svaghet och världens verklighet.	3.200
main-news	MSRpar	Jag är stolt över att jag stod emot Richard Nixon, inte med honom, sa Kerry.	Jag marscherade på gatorna mot Richard Nixon och Vietnamkriget, sa hon.	2.400
main-news	MSRpar	Aktierna i Corixa steg 71 cent, eller 10 %, till 7,91 dollar på Nasdaq.	Under den sena morgonhandeln på Nasdaq-börsen steg Corixa med 74 cent, eller 10 %, till 7,94 dollar.	3.250
main-news	MSRpar	Talesmän för FBI, CIA, Canadian Security Intelligence Service och Royal Canadian Mounted Police avböjde att kommentera El Shukrijumahs vistelse i Kanada.	FBI, CIA, Canadian Security Intelligence Service och Royal Canadian Mounted Police avböjde att kommentera Washington Times-rapporten.	2.750
main-news	MSRpar	Det här har varit ett ihållande problem som inte har lösts, sade utredningsstyrelsens ledamot Steven Wallace.	Detta var ett ihållande problem som inte har lösts, mekaniskt och fysiskt, säger styrelseledamoten Steven Wallace.	4.000
main-news	MSRpar	Amerikaner skär inte och springer, vi måste se över detta missöde, sa hon.	Hon lovade också att skapa fred i Irak: Amerikanerna skär och springer inte, vi måste se över detta missöde.	3.600
main-news	MSRpar	Det råder ingen tvekan om det kemiska programmet, det biologiska programmet, faktiskt kärnkraftsprogrammet, faktiskt allt som dokumenterades av FN, sade han.	"Han tillade: ""Det råder ingen tvekan om det kemiska programmet, det biologiska programmet och faktiskt kärnvapenprogrammet."	3.800
main-news	MSRpar	Ridge sa att inga verkliga sprängämnen eller skadliga anordningar kommer att användas i övningen.	Ridge sa att inga egentliga sprängämnen eller andra skadliga ämnen kommer att användas.	4.600
main-news	MSRpar	Det här är Amerika, mina vänner, och det borde inte hända här”, sa han till höga applåder.	Detta är Amerika, mina vänner, och det borde inte hända här.	3.250
main-news	MSRpar	Den 1 maj kröp han genom en smal, slingrande kanjon, rappellerade nerför en 60-fots klippa och gick cirka sex mil nerför kanjonen.	Han kröp genom en smal, slingrande kanjon, rappellerade nerför en 60-fots klippa och gick cirka sex mil nerför kanjonen nära Canyonlands National Park i sydöstra Utah.	3.750
main-news	MSRpar	Amnesty International har sagt att de under de senaste 20 åren har samlat in information om 17 000 försvinnanden i Irak men den faktiska siffran kan vara mycket högre.	Amnesty International sa att de under de senaste 20 åren hade samlat in information om 17 000 försvinnanden i Irak.	4.000
main-news	MSRpar	Texas Instruments klättrade $1,37 till $19,25 i går och Novellus Systems Inc. avancerade $1,76 till $36,31.	"Texas Instruments klättrade $US1,37 till $US19,25 och Novellus Systems avancerade $US1,76 till $US36,31, var och en har höjts till ""överviktiga"" av Lehman."	3.750
main-news	MSRpar	Hon bad att få ursäkt från förra veckans regeringssammanträde för att förbereda sig för ett möte med Rwandas och Ugandas presidenter.	Hon tog det högst ovanliga steget att hoppa över regeringen för att delta i ett möte med Rwandas och Ugandas presidenter.	3.455
main-news	MSRpar	I en blandning av antika hedniska och moderna kristna riter har byborna arrangerat en serie ceremonier i hopp om att radera de olyckor som de tror har hållit dem fattiga.	I en blandning av forntida melanesiska hedniska och moderna kristna ceremonier försökte folket återigen utplåna de olyckor som de tror har hållit dem fattiga sedan måltiden för länge sedan.	4.000
main-news	MSRpar	Dow Jones industriindex .DJI steg upp 13,33 poäng, eller 0,15 procent, till 9 196,55.	Dow Jones industriindex <.DJI> sjönk 7,75 punkter, eller 0,08 procent, till 9 175,47.	2.500
main-news	MSRpar	Apkoppor finns vanligtvis bara i centrala och västra Afrika.	Präriehundar, som vanligtvis finns i sydvästra och västra stater, är inte inhemska i Wisconsin.	0.250
main-news	MSRpar	Filmen är den andra i en trilogi, som kommer att avslutas i november med The Matrix Revolutions.	"Reloaded är den andra delen av en trilogi; ""The Matrix Revolutions"" är planerad till premiär i november."	3.833
main-news	MSRpar	"Dessutom sa justitiedepartementet att FBI har genomfört ""färre än 10"" utredningar som involverar besök i moskéer."	"Dessutom har ""färre än 10"" FBI-kontor genomfört undersökningar som involverar besök i islamiska moskéer, sade justitiedepartementet."	3.750
main-news	MSRpar	Lanseringen sammanfaller med JavaOne-utvecklarkonferensen i San Francisco denna vecka.	Nyheten kommer också i samband med Suns årliga JavaOne-utvecklarkonferens i San Francisco.	3.250
main-news	MSRpar	A Royal Duty är baserad på hans erfarenheter av Diana, prinsessan av Wales och brev som påstås vara till och från henne.	Det kungliga hushållet rustade sig för ytterligare avslöjanden i A Royal Duty, baserad på den tidigare tjänarens tid med Diana, prinsessan av Wales.	2.750
main-news	MSRpar	Armén sa att razzian, som kommer bara några dagar efter att israeliska trupper sköt och dödade Abdullah Kawasme, Hamas-ledaren i staden, riktade sig mot militanter i Hamas.	Gripningarna kom bara några dagar efter att israeliska trupper sköt och dödade Abdullah Kawasme, den militanta gruppens ledare i Hebron.	3.000
main-news	MSRpar	SARS fortsatte med att kräva 44 människors liv i Toronto-området, inklusive två sjuksköterskor och en läkare.	Viruset dödade 44 personer i Toronto-området, inklusive en läkare och två sjuksköterskor.	3.200
main-news	MSRpar	Apple Computers nya musiktjänst online sålde mer än 1 miljon låtar under sin första verksamhetsvecka, uppgav företaget i måndags.	Apple Computer Inc. sa i måndags att de överträffade skivbranschens förväntningar genom att sälja mer än 1 miljon låtar sedan lanseringen av sin musikbutik online för en vecka sedan.	4.600
main-news	MSRpar	Han hade gripits två gånger tidigare för intrång och spärrats från komplexet - hem till hans mamma och två barn.	Han hade gripits två gånger tidigare för intrång och stängdes av från komplexet.	3.600
main-news	MSRpar	Oracle Corps styrelseordförande och vd Larry Ellison uteslöt inte att sockra företagets oönskade erbjudande att förvärva rivalen PeopleSoft Inc.	Oracles ordförande Larry Ellison har antytt att företaget ännu en gång kan öka sitt erbjudande för konkurrenten PeopleSoft.	4.400
main-news	MSRpar	Den portugisiska vädertjänsten sa att Europas värmebölja orsakades av en massa varm, torr luft som rörde sig från sydost.	Värmeböljan berodde på en massa varm, torr luft från sydost, säger Mario Almeida från Portugals vädertjänst.	4.056
main-news	MSRpar	Att spendera skattebetalarnas dollar för att skapa spelhallar för terrorism är lika slösaktigt som det är motbjudande, meddelade de vid en presskonferens igår.	Att spendera skattebetalarnas dollar för att skapa spelhallar för terrorism är lika slösaktigt som det är motbjudande, sa Wyden och Dorgan på måndagen i ett brev till Pentagon.	3.500
main-news	MSRpar	"Ändå kan den ""något tvetydiga domen"" vara ett bakslag för Static Control beroende på hur den utvecklade sin konkurrerande produkt, sa Merrill Lynch-analytiker Steven Milunovich."	"Men Merrill Lynch-analytikern Steven Milunovich sa att det ""något tvetydiga beslutet"" från tillsynsmyndigheter kan vara ett bakslag för Static Control beroende på hur den utvecklade sin konkurrerande produkt."	5.000
main-news	MSRpar	Aporna kunde spåra sina framsteg genom att se en schematisk representation av armen och dess rörelser på en videoskärm.	Armen förvarades i ett separat rum, men aporna kunde följa sina framsteg genom att se en representation av armen och dess rörelser på en videoskärm.	4.000
main-news	MSRpar	Det utlöste ett 47-timmars polisstopp som besvärade tusentals pendlare, eftersom trafiken backade upp i Downtown Washington och norra Virginia.	Hans protest ledde till ett 47-timmars stopp med polisen som orsakade enorma trafikstockningar i centrala Washington och norra Virginia.	4.000
main-news	MSRpar	Standard & Poor's 500-index steg 6,48, eller 0,7 procent, till 990,51.	Det bredare Standard & Poor's 500 Index .SPX steg 6,48 punkter, eller 0,66 procent, till 990,51.	4.750
main-news	MSRpar	Jordbruksministrar från mer än hundra nationer förväntas delta i den tre dagar långa ministerkonferensen och utställningen om jordbruksvetenskap och teknologi som sponsras av det amerikanska jordbruksdepartementet.	USA:s jordbruksminister Ann Veneman inleder den tre dagar långa ministerkonferensen och utställningen om jordbruksvetenskap och teknologi på måndag.	3.750
main-news	MSRpar	Komplicerar situationen gör närvaron av stridshärdade liberianer som har slagits på båda sidor.	Striderna har fortsatt sporadiskt i väster, där de kompliceras av närvaron av stridshärdade liberianer på båda sidor.	4.000
main-news	MSRpar	I år är Audubon Society åter värd för sin årliga julfågelräkning.	Det är National Audubon Societys årliga Christmas Bird Count, nu inne på sin 104:e säsong.	3.500
main-news	MSRpar	Innan den togs bort listade webbplatsen på bruten engelska reglerna för hackare som kan delta.	Arrangörerna etablerade en webbplats, http://defacerchallenge.com, som på bruten engelska listade reglerna för hackare som kan delta.	3.000
main-news	MSRpar	Läkare har spekulerat i att kroppens eget östrogen skyddar mot cellskador och förbättrar blodflödet.	Deras övertygelse var baserad på spekulationer om att östrogen förhindrar cellskador och förbättrar blodflödet.	4.200
main-news	MSRpar	De fann också att korthet var associerad med en familjehistoria av hörselnedsättning.	Korthet konstaterades dubbelt så ofta hos personer med hörselnedsättning.	3.400
main-news	MSRpar	Ciscos chefer sa att de var uppmuntrade av 1,3 miljarder dollar i kassaflöde och ökningen av nettoinkomsten, men hoppades på en återhämtning.	"Ciscos chefer uppmuntrades av 1,3 miljarder dollar i kassaflöde och ökningen av nettoinkomsten, men sa att de förblev ""försiktigt optimistiska"" om en återhämtning."	4.600
main-news	MSRpar	I ett e-postmeddelande till Knoxville News Sentinel sa Shumaker: ''Jag överväger inte att avgå.	"Jag överväger inte att avgå,"" säger Shumaker i ett uttalande."	4.000
main-news	MSRpar	En omröstning visade att FBI:s avlyssning av borgmästaren hade gett ett uppsving till hans omvalsinsats mot GOP-motståndaren Sam Katz.	En undersökning som släpptes den här veckan visade att FBI:s avlyssning av borgmästaren har gett ett uppsving för hans omvalsinsats.	4.000
main-news	MSRpar	Den skadade passageraren på John Peter Smith Hospital dog senare på fredagsmorgonen, sa Jones.	Den skadade passageraren på John Peter Smith dog senare på morgonen; hans namn har inte släppts, sa Jones.	3.643
