genre	file	sentence_1	sentence_2	label
main-news	headlines	Washington: Mer Än 100 Åtalas i Medicare Fraud Sweep	Washington: Domstolen Upprätthåller Rösträttslagen i Fallet Alabama	0.6
main-news	headlines	Putin hävdar segern i Rysslands presidentval	Putin hävdar seger i presidentomröstningen	4.2
main-news	headlines	Clinton redo att slåss för Obama	Clinton en tuff handling för Obama att följa	1
main-news	headlines	Romney tillkännager Paul Ryan som vicepresidentkandidat	Romney väljer Ryan som GOP-kandidat	4.4
main-news	headlines	De europeiska marknaderna stiger på grekiska räddningsaktioner	Europeiska Ministrar Är Redo att Godkänna Grekisk Räddning	2.2
main-news	headlines	Edwards Frikänd på 1 Punkt, Misshandel mot Andra	Edwards befanns oskyldig på en punkt; misshandel av andra	4.6
main-news	headlines	Den ukrainska tyngdlyftaren får fyra års dopingavstängning	Ukrainas Korobka får fyra års dopingavstängning	4.2
main-news	headlines	Vapenman kan ha filmat skolmassakern	Mördare kan ha filmat skolskjutning i Frankrike	3
main-news	headlines	Hongkongbörsen stänger ned 0,28 %	Hongkongaktier öppnar 0,62 pct högre	1.6
main-news	headlines	Självmordsbombare attackerar algerisk säkerhetsbas	Självmordsbombare riktar sig till den nigerianska kyrkan	0.8
main-news	headlines	Thailand: Iranier planerade att attackera israeler	Malaysia för att utlämna iranier för attack mot israeler	1
main-news	headlines	Israelisk militärdomstol avvisar överklagandet av palestinsk hungerstrejkande	Israel når en överenskommelse med palestinska hungerstrejkande	1.2
main-news	headlines	Avengers sätter kassarekord	Hungerspelen' sätter kassarekord	1.6
main-news	headlines	Putin 'Vinner det Ryska Presidentvalet'	"Putin ""vinner"" Rysslands presidentval"	4.2
main-news	headlines	Putin röstar när ryssarna röstar	Putin kommer vinna presidentvalet i Ryssland	1.4
main-news	headlines	FN-Chefen Finner Sin Röst, Förblir Försiktig med Kina	Insikt: FN-chefen finner sin röst, men är fortfarande försiktig med Kina	4.8
main-news	headlines	Libyer börjar lämna in vapen	Libyerna överför vapen till armén	3.2
main-news	headlines	Den brittiske ärkebiskopen av Canterbury byter karriär till Cambridge	Ärkebiskopen av Canterbury avgår mitt i klyftor	2.4
main-news	headlines	Punjab Mail spårar ur nära Rohtak, 19 skadade	Punjab Mail spårar ur nära Rohtak i Haryana, 19 skadade	4.2
main-news	headlines	George Zimmerman 'kommer åtalas' för att ha dödat Trayvon Martin	George Zimmerman kommer åtalas i Trayvon Martin-fallet, säger tjänstemannen	4
main-news	headlines	Indiska maoistiska rebeller erbjuder samtal för att befria italienska gisslan	Indien: Maoistiska rebeller i samtal om att befria italienare	3.8
main-news	headlines	Två rapporteras döda i skottlossning i Empire State Building i NY	City Room: Empire State Building-Skjutning	2.8
main-news	headlines	Fem döda i Pakistans självmordsexplosion	Minst 63 döda i en fabriksbrand i Pakistan	1
main-news	headlines	Penn State fotbollsspelare reagerar på sanktioner	Penn State fotboll drabbades av NCAA-sanktioner	2.4
main-news	headlines	Israel måste släppa eller pröva palestinier i långvarig hungerstrejk	Israels minister vill att den palestinska ledaren avsätts	0.5
main-news	headlines	FN-rapport säger att båda sidor i Syrien kränker rättigheterna	NATO-ledaren tonar ner risken för sammandrabbningar mellan Turkiet och Syrien	1
main-news	headlines	Flicka som anklagas för att ha bränt Koranen göms	Flickan som anklagas för att ha bränt Koranen släpps lös	3.2
main-news	headlines	Frankrike varnar Syrien för användning av kemiska vapen	FN oroar sig över eventuella kemiska vapen från Syrien	2.2
main-news	headlines	Livshotande mellanvästernstormar befaras	Livshotande' stormar fruktade för mellanvästern	4.4
main-news	headlines	Lärarstrejken i Chicago närmar sig sitt slut med ett 'ramavtal' på plats	Generalstrejken slutar: Histadrut, finansministeriet når en överenskommelse	0.8
main-news	headlines	Indonesiens president besöker Storbritannien	Indonesiens president besöker Australien	1.4
main-news	headlines	Stormen försenar starten av det republikanska konventet	Stormen piskar Florida och försenar det republikanska konventet	4.4
main-news	headlines	Minst två Nato-dödade i Afghanistans helikopterkrasch: militär	Minst 18 dödade i afghanska bombattentat: tjänstemän	0.8
main-news	headlines	President Mills måste sluta - Föreläsare	President John Evans Atta-Mills Måste Avgå Nu -NPP Tyskland	2.6
main-news	headlines	Miami Heat vinner NBA-finalen	Miami Heat vinner NBA-mästerskapet	5
main-news	headlines	Japan stänger sista kärnreaktorn	Japan stänger av det sista kärnkraftverket i helgen	4.2
main-news	headlines	Ryanair i nytt bud på Aer Lingus	Ryanairs chef hyllar rapportens resultat	1.2
main-news	headlines	Det ryska flygvapnet firar 100-årsjubileum	Ryska flygvapnets 100-årsjubileum	4.4
main-news	headlines	6 NATO-trupper dödade i Afghanistan	NATO-soldat dödad i Afghanistan	2.2
main-news	headlines	Inte så Supertisdag för Mitt Romney	Romney leder Santorum i GOP Super Tisdag-tävlingar	1.6
main-news	headlines	Putin svors in när den ryska tillväxten avtar	Putin svors in som Rysslands president i sex år	2.4
main-news	headlines	ArQule, Daiichi stoppa lungcancerförsöket, delar tank	ArQule-aktien sjunker när lungcancerstudier lades på hyllan	3.4
main-news	headlines	Tonåring och pappa dödades i krasch	Tre dödade i skräckolyckan är namngivna	1.6
main-news	headlines	Skalvet med magnituden 6,1 drabbar Indonesien	Skalvet med magnituden 6,1 drabbar Papua, Indonesien -- USGS	4.2
main-news	headlines	2 Amerikaner Dödade när Afghanska Oroligheter Inträder på Femte Dagen	Två Amerikanska Officerare Mördades När Oroligheterna i Afghanistan Fortsätter	4.2
main-news	headlines	Tjänstemän: Romney kommer att få skydd från Secret Service	Obama tar upp Secret Service-skandalen	0.6
main-news	headlines	Japans premiärminister kräver snabbare tsunamiavfallshantering	Japan uppmärksammar ett år sedan jordbävningen och tsunamikatastrofen	1
main-news	headlines	Syrisk stridspilot hoppar av till Jordanien	Syriens premiärminister hoppar av till Jordanien	1.4
main-news	headlines	Syrien (den): Syrien: Syriska flyktingar (sedan den 28 juni 2012)	Syrien (den): Mer än 70 dödade i Syrien innan Annan återvände	1.2
main-news	headlines	Självmordsbombare dödade 16 i Afghanistan	Självmordsbombare dödade 12 i kyrka i Nigeria	1.2
main-news	headlines	Flygbolag avbokar 'flytilla'-aktivisters biljetter till TA	Det Brittiska Flygbolaget Ställer in 'Flytilla'-Biljetter på Israels Invändningar	3.2
main-news	headlines	Spanien ber om bankräddning	Spanjor åtalad för kubansk dissidents död	0.2
main-news	headlines	Sydkinesiska havets grumliga vatten	Fred ligger över Sydkinesiska havet	1.4
main-news	headlines	Sri Lanka strävar efter en dags väckelse mot Pakistan	Senior journalist dödad i Pakistan	0.6
main-news	headlines	SpaceX dockar med International Space Station: Nästa, offentliga resor?	SpaceX Dragon lägger till med internationell rymdstation	3.8
main-news	headlines	Million Muppet March' för att försvara Obamas stöd till PBS	Million Muppet March planerade att försvara USA:s stöd till PBS	4
main-news	headlines	Syrisk opposition i försoningssamtal	Syriska Oppositionsrådet Ska Inrätta Sändebud i Frankrike	1.4
main-news	headlines	Sensex minskade med 193 poäng på budgetblues	Romney kommer inte frivilligt med budgetskillnader	1
main-news	headlines	Facebook ökar börsintroduktionen med 25 procent för att samla in 15 miljarder dollar	Facebook ökar storleken på börsintroduktionen med 25 procent	3.6
main-news	headlines	Irans Parlament Ifrågasätter en Avvisande Ahmadinejad	Irans parlament ifrågasätter president Ahmadinejad	4
main-news	headlines	Jemen självmordsattack dödar 7 soldater: tjänstemän	Afghansk självmordsbilbomb dödar minst sju: tjänstemän	1.6
main-news	headlines	Presidentomröstningen polariserar egyptierna	GOP:s presidentförhoppningar drabbar samman i södra lopp	0.8
main-news	headlines	Ytterligare tre amerikanska soldater dödades i Afghanistan	NATO-Soldat Dödad i Afghanistan	1.8
main-news	headlines	Polisen höjer dödssiffran i bussolycka till 8	Rodney Kings död dömdes till oavsiktlig	0.4
main-news	headlines	Fyra utländska soldater dödade i östra Afghanistan	2 brittiska soldater dödade i afghansk insiderattack	0.8
main-news	headlines	Röda korsarbetare dödad i Pakistan	Brittisk Röda Korsets läkare kidnappad i Pakistan hittades halshuggen	3.6
main-news	headlines	Afghanska, amerikanska regeringar undertecknar avtal om kontroversiell natträd	Afghaner, USA undertecknar avtal om natträder	3.8
main-news	headlines	Minolycka i Kina dödar 10	Lastbilsolycka i Kina dödar 20	1.6
main-news	headlines	Australien kan förmörka England i Windies	Australiens premiärminister trotsar under press över ledarskap	0.4
main-news	headlines	Protester mot Pussy Riot-domen	Pussy Riot-domen hälsades med trots	3.4
main-news	headlines	Secret Service ser sin 'största skandal' över prostituerade	Secret Service sexskandal 'ångrar'	2.2
main-news	headlines	Kuwait: Aktivister stormar Syriens ambassad; två skadade	Aktivister stormar Syriens ambassad i Kuwait	3.4
main-news	headlines	Detaljer om Aung San Suu Kyis besök i Irland	Häftigt välkomnande för Aung San Suu Kyis historiska resa	3.4
main-news	headlines	Key säger att marae besöker en förlorad möjlighet	Key vill att Waitangi marae-besöket ska stanna	2.2
main-news	headlines	Norge uppmärksammar årsdagen av massakern	Norge Uppmärksammar Årsdagen av Breiviks Massaker	3.8
main-news	headlines	Kvinna dödad av fallande skräp	När en allierad tackar nej	0
main-news	headlines	Aust aktie upp 1% efter räntesänkning	RBA levererar ytterligare en räntesänkning	1
main-news	headlines	Tyskland varnar Grekland: Inga fler pengar utan reformer	Eurozonen till Grekland: Ingen räddning utan reformer	2.6
main-news	headlines	Obama kommer att träffa familjer till skottoffer	Obama kommer att träffa Batmans vapenoffer	3.2
main-news	headlines	Obama utökar försprånget över Romney trots jobbdata: Reuters/Ipsos opinionsundersökning	"Romney tar ledningen över Obama med konventionens ""studs"": Reuters/Ipsos-undersökning"	1
main-news	headlines	Två dödade och 19 skadade i skottlossningen i Toronto	Två döda, 7 skadade i skottlossning i Finland	1.4
main-news	headlines	Vad påvens butler såg – medhjälpare arresterad för Vatikanläckor	Påvens butler arresterad i skandal över Vatikanläckor	3.4
main-news	headlines	Anti-Putin demonstranter bildar mänsklig kedja i Moskva	Anti-Putin demonstranter bildar mänsklig kedja	3.8
main-news	headlines	Washingtons Acts of Congress säljs för 9,8 miljoner dollar	George Washingtons kopia av US Constitution säljs för 9,8 miljoner dollar	2.6
main-news	headlines	Lakers Brandtränare Mike Brown Efter Start 1-4	Lakers sparkar Mike Brown efter 1-4 start	4.4
main-news	headlines	Kanadensiska muslimer utfärdar fatwa mot 'hedersmord'	USA, kanadensiska imamer utfärdar fatwa mot hedersmord	3.4
main-news	headlines	F.N. ska ta upp Syrien-resolutionen	FN:s Församling ska Rösta om Syriens Resolution	3.6
main-news	headlines	Soldat 'kommer inte ihåg' massakern	"Amerikansk soldat ""minns inte massakern"""	4.4
main-news	headlines	Libyens premiärminister namnger nytt kabinett efter protester mot originalet	Libyens församling avvisar nytt kabinett, avfärdar premiärministern	1.2
main-news	headlines	4 utländska soldater dödade i östra Afghanistan	4 Franska Soldater Rapporteras Dödade i Afghanistan	3.8
main-news	headlines	Syriska styrkor stormar centrala staden	Syriska styrkor bombarderar Homs, Ryssland varnar för inbördeskrig	2.5
main-news	headlines	Pak: 20 döda i anti-islam filmprotester	25 skadades i anti-islam filmprotest i Islamabad, Pakistan	2.2
main-news	headlines	Orsaken till Whitney Houstons död kan ta veckor	Utredarna söker svar på Whitney Houstons död	1.8
main-news	headlines	Nordkorea varnar för vedergällning för Sydkoreas övning	Nord varnar för vedergällning för Seouls marinövningsplan	3.6
main-news	headlines	En Berättelse om Två Pass: Hur New York Giants Vann Super Bowl	Mindre av två onda segrar i Super Bowl	1.4
main-news	headlines	En död i en ny israelisk attack mot Gaza	Två dödade i en ny israelisk attack mot Gaza: läkare	3.6
main-news	headlines	Tyskland Kommer Sannolikt att Pressa Ryssland om Krisen i Syrien	Vad tänker Ryssland om Syrien? En kort guide	1
main-news	headlines	Fyra skadades allvarligt i motorvägskrock M23	Fyra skadade i motorvägskrock	3.6
main-news	headlines	FN:s biståndschef Amos går in i Baba Amr med Röda halvmånen	Syriens belägrade Baba Amr är öde, säger Röda Korset	2
main-news	headlines	Dussintals dödade i upplopp i Nigeria	Dussintals dödade i kenyanska sammandrabbningar	1
main-news	headlines	Profiler av Egyptens främsta presidentkandidater	Andra dagen av det egyptiska presidentvalet	1.2
main-news	headlines	Skådespelaren Gazzara död vid 81 års ålder	Skådespelaren Ben Gazzara dör vid 81 år	4.4
main-news	headlines	Brittisk guldrush tystar klagomålen över kostnaden	2 brittiska soldater dödade i afghansk insiderattack	0.6
main-news	headlines	Lavin begraver minst 100 pakistanska soldater	Lavin begraver över 100 pakistanska soldater	4.6
main-news	headlines	Inflationen faller till 15-månaders lägsta: vad analytikerna säger	Inflationen faller till 15 månaders lägsta	4.6
main-news	headlines	Komen kommer inte att minska finansieringen av Planned Parenthood	Susan G Komen i U-turn över Planned Parenthood-finansiering	3
main-news	headlines	Forex & guld 25 augusti 2012	Forex & guld 19 juli 2012	2.2
main-news	headlines	Iran säger att FN:s kärnkraftsförhandlingar kommer att fortsätta	Iran säger att kärnkraftssamtalen med FN är 'konstruktiva'	2.8
main-news	headlines	Agribusiness: Galna ko-sjukan hittad i Kalifornien	USDA Bekräftar Fall av Galna Kosjukan i Kalifornien	4.2
main-news	headlines	BP säljer några tillgångar i Mexikanska golfen för 5,55 miljarder dollar	BP säljer Mexikanska golfens tillgångar till Plains för 5,55 miljarder dollar	3.6
main-news	headlines	300 potentiella Jimmy Savile-offer: polisen	Storbritannien: 300 potentiella Savile-missbruksoffer dyker upp	3.6
main-news	headlines	Armstrong kliver av från Livestrong	Armstrong står ner från Livestrong	4.6
main-news	headlines	USA:s drönareanfall dödar 5 militanter i Pakistan	Amerikanska drönarangrepp dödar 16 misstänkta militanter i Jemen	1.8
main-news	headlines	Syriens regering kommer inte att stoppa attackerna	Syrisk opposition rapporterar 'massaker'	1
main-news	headlines	Kinesiska börser stänger högre middag på fredag	Kinesiska börser steg vid middagstid fredag	4.6
main-news	headlines	Myanmar: Oppositionen hävdar att Suu Kyi vinner	Väljare i Myanmar är hoppfulla när Suu Kyis parti hävdar att de vinner	3.2
main-news	headlines	Obamas opinionsundersökning sjunker i uppsving för republikanska rivaler	Obamas stora spansktalande vinst oroar republikanerna	1
main-news	headlines	Två australiska soldater skadades i Afghanistan	4 utländska soldater dödade i östra Afghanistan	1.2
main-news	headlines	Ny oppositionschef i Syrien vill ha obunden hjälp	Syriens opposition förenas när Israel skjuter varningsskott	1
main-news	headlines	Minkrock i Sydafrika dödar minst 30 personer	Tågkrasch i Sydafrika dödar 26	0.8
main-news	headlines	Syriska styrkor bombarderar Homs, Ryssland varnar för inbördeskrig	Syriska styrkor bombarderar Homs, Lavrov anländer för samtal	2.6
main-news	headlines	Egyptens presidentvalsresultat försenat	Egyptiska valresultatet försenat	4.2
main-news	headlines	Tidsfristen passerar utan nya sanktioner mot Iran	EU Går Närmare Nya Sanktioner mot Iran	1.6
main-news	headlines	Arresterad rysk mördare förnekar band till Pussy Riot	Dussintals arresterade i ryska tv-tornprotest	0.8
main-news	headlines	Norges minnesmärke hedrar 77 massakeroffer	Norge uppmärksammar årsdagen av massakern	2.8
main-news	headlines	USA:s general i Afghanistan kopplas till Petraeus-skandalen	Senior amerikansk general kopplad till Petraeus-skandalen	3.8
main-news	headlines	Kinesiska aktier faller efter RRR-sänkning - 14 maj	Kinesiska börser stiger vid lunchtid på måndagen	2
main-news	headlines	"NKorea gör ""betydande"" kärnreaktorframsteg - IAEA"	N. Korea lovar att utöka kärnvapenavskräckningen	2.8
main-news	headlines	Maldivernas president avgår efter polismyteri, protester	Maldivernas president avgår efter veckor av protester	3.4
main-news	headlines	NATO:s anfall 'dödar civila' i Afghanistan	Två NATO-soldater dödade i Afghanistan	0.8
main-news	headlines	Al-Qaida säger att de fångar 70 jemenitiska soldater i Abyans strid	Al-Qaida-sammandrabbningar, explosioner dödar 35 soldater i Jemen	1.4
main-news	headlines	Navy jet kraschar in i amerikanska lägenheter, piloter kastar ut	US Navy Jet Kraschar in i Virginia Lägenhetsbyggnader	3.4
main-news	headlines	Kinas börs öppnade högre på onsdag	USA-aktier öppnar högre trots BNP-miss	0.8
main-news	headlines	IDF kommer att placera ut Iron Dome i centrala Israel	Stora snöstormstunnor nere på Central Plains	0
main-news	headlines	4 Dödade i USA:s Drönaranfall i Pakistan	USA:s Drönarangrepp Dödar 3 i Pakistan	3
main-news	headlines	Amerikansk tonåring hålls i Chicago 'jihad' bilbombplan	Chicago tonåring greps i Chicago bilbombplan	3.4
main-news	headlines	PC David Rathband: tvillingbrors rädsla för sin 'bästa kompis'	David Miliband: min bror och en återgång till gamla Labour	0.2
main-news	headlines	Syriska styrkor försöker återta Aleppo	Den Syriska Regimen Bjuder på att Återta Staden Aleppo	4.4
main-news	headlines	20-manna parlamentariska, handelsteam åker till Indien	Handelssekreterare tar tjänstledigt	0
main-news	headlines	Wall Street Öppnar Lägre	Wall Street Slutar Blandat	2
main-news	headlines	Europaaktier studsar i takt med att fler Kinastimulanser ses	Oljepriset stiger på hopp om stimulanser	0.8
main-news	headlines	Aktieindexterminer pekar mot lägre start	Aktieindexterminer signalerar tidiga förluster	4.4
main-news	headlines	Man åtalad efter att MP skadats i attack	Man åtalad för mord i lägenhet	1.4
main-news	headlines	Nokia ber om ursäkt för 'förfalskad' annons	USA avstår från ryttare för Pak-stöd	0
main-news	headlines	USA:s drönaranfall dödar 5 militanter i Pakistan	Drönarangrepp dödar fyra misstänkta militanter i Pakistan	3
main-news	headlines	Syriska rebeller lämnar belägrade Homs	Syriska rebeller drar sig tillbaka från det belägrade Homs-distriktet	4.4
main-news	headlines	USA beordrar icke-nödvändig personal att lämna Sudan, Tunisien	USA beordrar icke-nödvändig personal att lämna Tunisien, Sudan	4
main-news	headlines	Egyptens Mubarak kritisk	Egyptens Mubarak i kritiskt tillstånd	4.6
main-news	headlines	Assad säger att legosoldater ligger bakom oroligheterna i Syrien	Assad Anklagar USA för att Underblåsa Upproret i Syrien	3.33333333333333
main-news	headlines	Japans premiärminister upplöser underhuset för val	Iran och världsmakter inleder nukleära samtal	0
main-news	headlines	Två dödade i en ny israelisk attack mot Gaza: läkare	5 dör i anfall mot Gaza, militanta störtar Israel	2
main-news	headlines	Navy jet kraschar in i Virginia-byggnader och skadade sex	Navy jet kraschar in i Virginia lägenheter, 9 skadade	3.2
main-news	headlines	En NATO-soldat dödades i S. Afghanistan	Brittisk soldat dödad i södra Afghanistan	3.2
main-news	headlines	Arbetslösheten i Spanien når ny höjd	Spaniens arbetslöshetsanmälningar nådde ny topp	4.2
main-news	headlines	Turkiet förvränger jetplan nära gränsen	Turkiet förvränger jetplan till den syriska gränsen	3.6
main-news	headlines	Två dör i våldet i Syrien efter att FN-övervakare landat	Två års dopingavstängning för Contador	0
main-news	headlines	Civil, avhoppare dödad i Syrien, säger NGO	Syriska beväpnade män dödar tre syriska officerare: NGO	1
main-news	headlines	Taiwan skramlade av kraftig jordbävning	Kina skakades av dubbla jordbävningar	1.2
main-news	headlines	Bank of Englands Paul Tucker besudlad av Libor-röran	Bank of Englands ställföreträdare förnekar att han beordrat räntefusk	2.8
main-news	headlines	Röda Korset säger att förhandlingarna stoppar striderna i Syrien för att ta hjälp	Röda Korset förhandlar om vapenvila i Syrien för att få hjälp	4.4
main-news	headlines	Syriska styrkor skjuter civila på buss	Syriska styrkor, rebeller drabbar samman nära Turkiet	0.8
main-news	headlines	Det tyska parlamentet stöder överväldigande det grekiska räddningsavtalet	Det tyska parlamentet godkänner grekisk räddningsaktion	4.4
main-news	headlines	Bombningar, sammandrabbningar fortsätter i Syrien	Bombningar, sammandrabbningar när oppositionen i Syrien söker vapen	3.4
main-news	headlines	Burmas reformer medför lättnader av amerikanska sanktioner	Burmaaktivister säger gå långsamt med att lätta på sanktionerna	2.4
main-news	headlines	Usain Bolt vinner 200m – Steven Howards reaktion	Facebook-mobilvinster driver intäktsökning: reaktion	0.2
main-news	headlines	Dussintals döda i talibanernas resortattack	Indien polis namnger tre iranier i ambassadattack'	0.4
main-news	headlines	Hårda strider skakar östra Syrien inför omröstningen	Hårda strider skakar östra Syrien - invånare	3.8
main-news	headlines	Kinas yuan försvagas till 6,3282 mot USD i måndags	Kinas yuan backar till 6,2697 mot USD på torsdag	2.8
main-news	headlines	7 döda i skjutning i kristen skola	5 skadade i skolskjutning i Ohio	1.4
main-news	headlines	Indonesiens antiterrorgrupp dödar två misstänkta militanter	Indonesiens polis skjuter ihjäl misstänkta militanter på Bali	3.2
main-news	headlines	USA-val: Mitt Romney medger nederlag när Barack Obama vinner andra mandatperioden	Romney medger val till Obama i telefonsamtal	4
main-news	headlines	Armenier röstar i parlamentsval	Armeniens parlamentariska omröstning ett test för president	3.2
main-news	headlines	Sachin Tendulkar svurs in som indisk senator	MP Sachin Tendulkar säger nej till regeringens bungalow	1.6
main-news	headlines	Navy Jet Kraschar In i Hyreshus	US Navy Jet Kraschar In i Virginia Lägenhetsbyggnader	3.6
main-news	headlines	Romney vinner stort i primärvalet i Puerto Rico	Romney vinner primärvalet i Illinois	1.5
main-news	headlines	Yahoo! kommer att namnge Googles Mayer som VD: rapport	Yahoo utser Googles chef Mayer till VD	4.2
main-news	headlines	Amerikansk soldat som anklagas för massakern i Afghanistan anlitar en framstående kriminell advokat	Amerikansk soldat som anklagas för att ha dödat civila i Afghanistan identifieras	2
main-news	headlines	Skalvet med magnituden 6,0 drabbar norra Italien: USGS	Skalvet med magnituden 5,9 träffar Sundasundet, Indonesien: USGS	1.6
main-news	headlines	USA:s regering utser officiellt Haqqani-nätverket som terrorister	USA utser Haqqani-nätverket som terrorister	4.4
main-news	headlines	Motorracing: Button snabbast under årets första F1-träning	Button har bästa tiden efter första träningen	3
main-news	headlines	Rangers röstade in i division tre	Rangers röstade in i tredje divisionen	4.8
main-news	headlines	Newarks borgmästare räddar grannen från eld	Newarks borgmästare räddar granne från brinnande hus	4.2
main-news	headlines	F1-protester i Bahrain	En dag av ilska i Bahrain	2.25
main-news	headlines	New York-börsen öppnar igen på onsdag	DealBook: Börser Förbereder sig för att Öppna	3
main-news	headlines	Homs mortelbrand dödar 105	Homs offensiv dödar 200	2.6
main-news	headlines	Hundratals hedersstudenter dödades i skjutningen i Ohio	Begravningsuppsättning för skjutningsoffret i Ohio	2
main-news	headlines	Bomber i södra Thailand dödar 5, skadar 50	Bomber i Thailand dödar 14, skadar 340	3
main-news	headlines	Amerikanska lagstiftare tar nästa steg mot nya sanktioner mot Iran	Somalias lagstiftare ska rösta på ny president	0.2
main-news	headlines	Barack Obama medger att USA har 'fler kärnvapen än vi behöver'	Fransk beväpnad man vill 'dö med vapen i händerna'	0.4
main-news	headlines	2 raketer träffade i Eshkol-regionen; inga skador	10 raketer på 20 minuter i Eshkol Regional Council	1.8
main-news	headlines	Förrådda' funktionshindrade arbetare protesterar mot nedläggningar av Remploy	Första maj präglades av protester mot nedskärningar	0.6
main-news	headlines	DR Kongo rebeller dödar parkvakter	Rebeller dödar två parkvakter i östra Kongo	4
main-news	headlines	Nio pakistanska trupper dödades i militant bakhåll	Handel: Pakistan, Indien är överens om att ta det ett steg före	0.8
main-news	headlines	74 döda i Egyptens fotbollsvåld	Minst 73 dör i invasion av egyptisk fotbollsplan	3.2
main-news	headlines	Oroligheter i det spända Nigeria lämnar minst 95 döda	Skalvet i sydvästra Kina dödar minst 50	0.2
main-news	headlines	Orkanen Sandy landar i sydöstra Jamaica: NHC	Orkanen Sandy når Jamaica	3
main-news	headlines	Anmärkningar Med Premiärminister Elkeib Efter Deras Möte	Anmärkningar Med Utrikesminister Koichiro Gemba	1.5
main-news	headlines	Barrick i samtal med ett kinesiskt företag om afrikanska tillgångar	Obama-assistent håller samtal i Kina efter Syrienveto	1.2
main-news	headlines	Köpcentrumangripare använde 'less is more'-strategin	I Kenya använde angripare strategin 'less is more'.	3
main-news	headlines	Svaga vinster drar ner aktierna	Svaga vinster drar ner aktierna på Wall Street	3.8
main-news	headlines	6.8-jordbävning inträffade utanför Salomonöarna	Skalvet med magnituden 6.3 inträffade utanför Salomonöarna: USGS	3.2
main-news	headlines	Läckage av flytande ammoniak dödar 15 personer i Shanghai	Läckage av flytande ammoniak dödar minst 15 personer i Shanghai	4.6
